Sheet: Summary
A1: Outgoing | B1: =SUM(Debts!C) -> 235739.55
A2: Incoming | B2: =inc -> 237600
A3: Left | B3: =R[-1]C-R[-2]C -> 1860.4500000000116

Sheet: Debts
A1: Line item | B1: Amount | C1: Consolidate (Y = yes, N = nice to have!) | D1: Payment | E1: Paid | G1: Transfer | H1: =100000-SUMIF(C[-3],"Y",C[-6]) -> 20160.449999999997
A2: Mortgage | B2: 103000 | G2: Left | H2: =SUMIFS(C[-6],C[-5],"=*",C[-3],"<>*") -> 15100
A3: Stone | B3: 4000 | C3: Y
A4: Funeral | B4: 0
A5: FD Loan | B5: 6064.98 | C5: Y | D5: 93.42 | E5: Y
A6: Barclaycard | B6: 10043.15 | C6: Y | D6: 235 | E6: Y
A7: Halifax | B7: 12281.92 | C7: Y | D7: 110 | E7: Y
A8: Ellie | B8: 10000
A9: Eadie | B9: 10000
A10: Ellie - Spousal | B10: =(36-(FLOOR(DAYS(NOW(),"26/05/2019")/28,1)))*500 -> 14000
A11: Next | D11: 175
A12: Cars | B12: =Cars!R[-8]C[-1] -> 25777 | C12: Y | E12: Y
A13: Thailand | B13: 600 | C13: Y
A14: Rachel cc | B14: 15000 | C14: Y | D14: 70 | E14: Y
A15: Tattoo | B15: 1800
A16: FD | B16: 1264.26 | C16: Y | E16: Y
A17: SAFA | B17: 2000 | C17: Y
A18: Amex | B18: 8359.24 | C18: Y | E18: Y
A19: Garden | B19: 1500 | C19: Y
A20: Holiday | B20: 4000 | C20: y
A21: Download | B21: 1000 | C21: N
A22: Floor | B22: 2000
A23: Ski trip | B23: 2000 | C23: N
A24: Tax | B24: 1049 | C24: Y | E24: Y

Sheet: Buy To Let scenario
G1: Bungalow improvements
A2: Consolidated debts: | B2: =SUMIF(Debts!C[1],"Y",Debts!C) -> 91939.549999999988 | D2: Repayments a month | E2: =SUM(Debts!C[-1]) -> 683.42000000000007 | G2: Kitchen | H2: 500
A3: Nice to haves: | B3: =SUMIF(Debts!C[1],"N",Debts!C) -> 3000 | D3: Buy to let repayment | E3: 170 | G3: Bathroom
A4: Improvements to the bungalow | B4: =SUM(C[6]) -> 4150 | D4: Potential better off: | E4: =R[-2]C-R[-1]C -> 513.42000000000007 | G4: Hall
A5: Sum: | B5: =SUM(R[-3]C:R[-1]C) -> 99089.549999999988 | G5: Lounge
D6: Let at | E6: 800 | G6: Porch | H6: 3500
D7: Management fees | E7: 50 | G7: Decorating costs | H7: 150
D8: Savings | E8: 100
D9: Profit | E9: =R[-3]C-SUM(R[-6]C,R[-2]C,R[-1]C) -> 480
D11: Total better off | E11: =R[-9]C+R[-2]C -> 1163.42

Sheet: Budget
F1: who | G1: Joint | J1: percentage | K1: pay to joint | L1: Cash reserve | M1: residual
B2: TV License | C2: 13 | D2: Monthly | E2: =IF(RC[-1]="Annual",RC[-2]/12,IF(RC[-1]<>"Monthly",RC[-2]*4,RC[-2])) -> 13 | F2: B | H2: Monthly outgoings | I2: =SUM(C[-4]) -> 6444.8466666666654
B3: June | C3: 300 | D3: Monthly | E3: =IF(RC[-1]="Annual",RC[-2]/12,IF(RC[-1]<>"Monthly",RC[-2]*4,RC[-2])) -> 300 | F3: B
B4: Gardener | C4: 70 | D4: Monthly | E4: =IF(RC[-1]="Annual",RC[-2]/12,IF(RC[-1]<>"Monthly",RC[-2]*4,RC[-2])) -> 70 | F4: B | H4: Incoming
B5: Cleaners | C5: 150 | D5: Monthly | E5: =IF(RC[-1]="Annual",RC[-2]/12,IF(RC[-1]<>"Monthly",RC[-2]*4,RC[-2])) -> 150 | F5: B | H5: Keith | I5: 5926 | J5: =RC[-1]/(RC[-1]+R[1]C[-1]) -> 0.80519951084741148 | K5: =(((SUMIF(C[-5],"B",C[-6])-R[2]C[-2])*RC[-1])+SUMIF(C[-5],"K",C[-6]))-SUMIFS(C[-6],C[-5],"K",C[-4],"N") -> 5213.5529516735351 | L5: =SUMIFS(C[-7],C[-6],"K",C[-5],"N") -> 232.25 | M5: =RC[-4]-(RC[-2]+RC[-1]) -> 480.19704832646494
B6: Groceries | C6: 500 | D6: Monthly | E6: =IF(RC[-1]="Annual",RC[-2]/12,IF(RC[-1]<>"Monthly",RC[-2]*4,RC[-2])) -> 500 | F6: B | H6: Rachel | I6: =((440*0.85)*46)/12 -> 1433.6666666666667 | J6: =RC[-1]/(R[-1]C[-1]+RC[-1]) -> 0.19480048915258844 | K6: =(((SUMIF(C[-5],"B",C[-6])-R[2]C[-2])*RC[-1])+SUMIF(C[-5],"R",C[-6]))-SUMIFS(C[-6],C[-5],"R",C[-4],"N") -> 854.04371499313083 | L6: =SUMIFS(C[-7],C[-6],"R",C[-5],"N") -> 145 | M6: =RC[-4]-(RC[-2]+RC[-1]) -> 434.62295167353591
B7: Fuel | C7: 200 | D7: Monthly | E7: =IF(RC[-1]="Annual",RC[-2]/12,IF(RC[-1]<>"Monthly",RC[-2]*4,RC[-2])) -> 200 | F7: B | H7: Rent
B8: Dog food | C8: 30 | D8: Monthly | E8: =IF(RC[-1]="Annual",RC[-2]/12,IF(RC[-1]<>"Monthly",RC[-2]*4,RC[-2])) -> 30 | F8: B
B9: Cat food | C9: 25 | D9: Monthly | E9: =IF(RC[-1]="Annual",RC[-2]/12,IF(RC[-1]<>"Monthly",RC[-2]*4,RC[-2])) -> 25 | F9: B | H9: Residual | I9: =SUM(R[-4]C:R[-2]C)-R[-7]C -> 914.82000000000153
B10: Vaccinations and treatments | C10: 200 | D10: Annual | E10: =IF(RC[-1]="Annual",RC[-2]/12,IF(RC[-1]<>"Monthly",RC[-2]*4,RC[-2])) -> 16.666666666666668 | F10: B
B11: Eadie's food card | C11: 30 | D11: Monthly | E11: =IF(RC[-1]="Annual",RC[-2]/12,IF(RC[-1]<>"Monthly",RC[-2]*4,RC[-2])) -> 30 | F11: R | G11: N
B12: Michael | C12: 110 | D12: Monthly | E12: =IF(RC[-1]="Annual",RC[-2]/12,IF(RC[-1]<>"Monthly",RC[-2]*4,RC[-2])) -> 110 | F12: R | G12: Y
B13: Overpayment of mortgage | D13: Monthly | E13: =IF(RC[-1]="Annual",RC[-2]/12,IF(RC[-1]<>"Monthly",RC[-2]*4,RC[-2])) -> 0 | F13: B
B14: Savings | D14: Monthly | E14: =IF(RC[-1]="Annual",RC[-2]/12,IF(RC[-1]<>"Monthly",RC[-2]*4,RC[-2])) -> 0 | F14: B
B15: hair | C15: 40 | D15: Monthly | E15: =IF(RC[-1]="Annual",RC[-2]/12,IF(RC[-1]<>"Monthly",RC[-2]*4,RC[-2])) -> 40 | F15: R | G15: N
B16: Keith's clothes | C16: 75 | D16: Monthly | E16: =IF(RC[-1]="Annual",RC[-2]/12,IF(RC[-1]<>"Monthly",RC[-2]*4,RC[-2])) -> 75 | F16: K | G16: N
B17: Dry cleaners | C17: 26 | D17: Monthly | E17: =IF(RC[-1]="Annual",RC[-2]/12,IF(RC[-1]<>"Monthly",RC[-2]*4,RC[-2])) -> 26 | F17: K | G17: N
B18: Window cleaner | C18: 15 | D18: Monthly | E18: =IF(RC[-1]="Annual",RC[-2]/12,IF(RC[-1]<>"Monthly",RC[-2]*4,RC[-2])) -> 15 | F18: B
B19: Council Tax | C19: 252.57 | D19: Monthly | E19: =IF(RC[-1]="Annual",RC[-2]/12,IF(RC[-1]<>"Monthly",RC[-2]*4,RC[-2])) -> 252.57 | F19: B
B20: Grand Charity | C20: 4 | D20: Monthly | E20: =IF(RC[-1]="Annual",RC[-2]/12,IF(RC[-1]<>"Monthly",RC[-2]*4,RC[-2])) -> 4 | F20: K | G20: Y
B21: Ellie FD | C21: 10 | D21: Monthly | E21: =IF(RC[-1]="Annual",RC[-2]/12,IF(RC[-1]<>"Monthly",RC[-2]*4,RC[-2])) -> 10 | F21: K | G21: Y
B22: Water | C22: 16.05 | D22: Monthly | E22: =IF(RC[-1]="Annual",RC[-2]/12,IF(RC[-1]<>"Monthly",RC[-2]*4,RC[-2])) -> 16.05 | F22: B
B23: Lodge | C23: 30 | D23: Monthly | E23: =IF(RC[-1]="Annual",RC[-2]/12,IF(RC[-1]<>"Monthly",RC[-2]*4,RC[-2])) -> 30 | F23: K | G23: Y
B24: Dog insurance | C24: 41.91 | D24: Monthly | E24: =IF(RC[-1]="Annual",RC[-2]/12,IF(RC[-1]<>"Monthly",RC[-2]*4,RC[-2])) -> 41.91 | F24: B
B25: Hannah | C25: 1500 | D25: Monthly | E25: =IF(RC[-1]="Annual",RC[-2]/12,IF(RC[-1]<>"Monthly",RC[-2]*4,RC[-2])) -> 1500 | F25: K | G25: Y
B26: Mortgage | C26: 1387.07 | D26: Monthly | E26: =IF(RC[-1]="Annual",RC[-2]/12,IF(RC[-1]<>"Monthly",RC[-2]*4,RC[-2])) -> 1387.07 | F26: B
B27: Contacts | C27: 34 | D27: Monthly | E27: =IF(RC[-1]="Annual",RC[-2]/12,IF(RC[-1]<>"Monthly",RC[-2]*4,RC[-2])) -> 34 | F27: K | G27: Y
B28: Mobile | C28: 57.47 | D28: Monthly | E28: =IF(RC[-1]="Annual",RC[-2]/12,IF(RC[-1]<>"Monthly",RC[-2]*4,RC[-2])) -> 57.47 | F28: K | G28: Y
B29: Scottish Provident | C29: 46.11 | D29: Monthly | E29: =IF(RC[-1]="Annual",RC[-2]/12,IF(RC[-1]<>"Monthly",RC[-2]*4,RC[-2])) -> 46.11 | F29: K | G29: Y
B30: Anglian - Sewerage | C30: 26 | D30: Monthly | E30: =IF(RC[-1]="Annual",RC[-2]/12,IF(RC[-1]<>"Monthly",RC[-2]*4,RC[-2])) -> 26 | F30: B
B31: Ellie CTF | C31: 21.3 | D31: Monthly | E31: =IF(RC[-1]="Annual",RC[-2]/12,IF(RC[-1]<>"Monthly",RC[-2]*4,RC[-2])) -> 21.3 | F31: K | G31: Y
B32: Help to buy | C32: 131.25 | D32: Monthly | E32: =IF(RC[-1]="Annual",RC[-2]/12,IF(RC[-1]<>"Monthly",RC[-2]*4,RC[-2])) -> 131.25 | F32: B
B33: Aviva Life | C33: 60 | D33: Monthly | E33: =IF(RC[-1]="Annual",RC[-2]/12,IF(RC[-1]<>"Monthly",RC[-2]*4,RC[-2])) -> 60 | F33: K | G33: Y
B34: Sky | C34: 60.5 | D34: Monthly | E34: =IF(RC[-1]="Annual",RC[-2]/12,IF(RC[-1]<>"Monthly",RC[-2]*4,RC[-2])) -> 60.5 | F34: B
B35: Buy to let | C35: 170 | D35: Monthly | E35: =IF(RC[-1]="Annual",RC[-2]/12,IF(RC[-1]<>"Monthly",RC[-2]*4,RC[-2])) -> 170 | F35: B
B36: NLIM | C36: 135 | D36: Annual | E36: =IF(RC[-1]="Annual",RC[-2]/12,IF(RC[-1]<>"Monthly",RC[-2]*4,RC[-2])) -> 11.25 | F36: K | G36: N
B37: Car Insurance | C37: 730 | D37: Annual | E37: =IF(RC[-1]="Annual",RC[-2]/12,IF(RC[-1]<>"Monthly",RC[-2]*4,RC[-2])) -> 60.833333333333336 | F37: B
B38: Home Insurace | C38: 230 | D38: Annual | E38: =IF(RC[-1]="Annual",RC[-2]/12,IF(RC[-1]<>"Monthly",RC[-2]*4,RC[-2])) -> 19.166666666666668 | F38: B
B39: Car Tax - big | C39: 145 | D39: Annual | E39: =IF(RC[-1]="Annual",RC[-2]/12,IF(RC[-1]<>"Monthly",RC[-2]*4,RC[-2])) -> 12.083333333333334 | F39: B
B40: Car Tax - Work | C40: 145 | D40: Annual | E40: =IF(RC[-1]="Annual",RC[-2]/12,IF(RC[-1]<>"Monthly",RC[-2]*4,RC[-2])) -> 12.083333333333334 | F40: B
B41: MGSL | C41: 96 | D41: Annual | E41: =IF(RC[-1]="Annual",RC[-2]/12,IF(RC[-1]<>"Monthly",RC[-2]*4,RC[-2])) -> 8 | F41: K | G41: Y
B42: Landlord insurance | D42: Annual | E42: =IF(RC[-1]="Annual",RC[-2]/12,IF(RC[-1]<>"Monthly",RC[-2]*4,RC[-2])) -> 0 | F42: B
B43: Chapter | C43: 120 | D43: Monthly | E43: =IF(RC[-1]="Annual",RC[-2]/12,IF(RC[-1]<>"Monthly",RC[-2]*4,RC[-2])) -> 120 | F43: K | G43: N
B44: UW | C44: 215 | D44: Monthly | E44: =IF(RC[-1]="Annual",RC[-2]/12,IF(RC[-1]<>"Monthly",RC[-2]*4,RC[-2])) -> 215 | F44: B
B45: Cat insurance | C45: 62 | D45: Monthly | E45: =IF(RC[-1]="Annual",RC[-2]/12,IF(RC[-1]<>"Monthly",RC[-2]*4,RC[-2])) -> 62 | F45: B
B46: Travel | C46: 91.800000000000011 | D46: Weekly | E46: =IF(RC[-1]="Annual",RC[-2]/12,IF(RC[-1]<>"Monthly",RC[-2]*4,RC[-2])) -> 367.20000000000005 | F46: K | G46: Y
B47: Agent fee | D47: Monthly | E47: =IF(RC[-1]="Annual",RC[-2]/12,IF(RC[-1]<>"Monthly",RC[-2]*4,RC[-2])) -> 0 | F47: B
B48: Bungalow reserve | D48: Monthly | E48: =IF(RC[-1]="Annual",RC[-2]/12,IF(RC[-1]<>"Monthly",RC[-2]*4,RC[-2])) -> 0 | F48: B
B49: Service charge | C49: 400 | D49: Annual | E49: =IF(RC[-1]="Annual",RC[-2]/12,IF(RC[-1]<>"Monthly",RC[-2]*4,RC[-2])) -> 33.333333333333336 | F49: B
B50: Rachel's clothes | C50: 75 | D50: Monthly | E50: =IF(RC[-1]="Annual",RC[-2]/12,IF(RC[-1]<>"Monthly",RC[-2]*4,RC[-2])) -> 75 | F50: R | G50: N

Sheet: Cars
A1: 3008 | B1: 25777 | D1: 208 | E1: 5600
A2: 308 | B2: 14100 | D2: 2008 | E2: 8500
A4: =SUM(R[-3]C[1]:R[-2]C[1])-SUM(R[-3]C[4]:R[-2]C[4]) -> 25777

Sheet: House sale numbers
A1: House sells at: | B1: 240000
A2: Solicitors | B2: 1020
A3: Fees | B3: =0.01*R[-2]C -> 2400
A4: Total | B4: =R[-3]C-R[-1]C -> 237600

Sheet: Bungalow running costs
A1: Shul | B1: 0
A2: Water | B2: 16
A3: Drainage | B3: 1
A4: UW | B4: 12
A5: TV | B5: 0
B6: =SUM(R[-5]C:R[-1]C) -> 29 | C6: =RC[-1]*5 -> 145 | E6: =4340.96-RC[-2] -> 4195.96
E7: 3500
E8: 1113.67
E9: 150
E10: =R[-3]C-SUM(R[-2]C:R[-1]C) -> 2236.33
E11: =R[-1]C-1904.82 -> 331.51